요리명,주재료,부재료,조리법 ,상세설명,데이터기준일자
녹차 초콜릿 컵케이크,"박력분 140g, 베이킹파우더 6g, 다크초콜릿 85g, 달걀 3개, 우유 30g, 녹차가루 4g, 코코아파우더 4g ","[양념] 소금 2g, 버터 110g, 설탕 145g, 바닐라익스트랙 1ts [프로스팅] 실온의크림치즈 200g, 실온의버터 80g, 슈가파우더 200g, 녹차가루 1TS","① 먼저 버터를 녹여주고 초콜릿도 중탕으로 녹여준다. ② 달걀에 설탕을 넣어주고 여기에 녹여둔 버터와 바닐라익스트랙을 넣어 섞어준다. ③ 미리 체 쳐둔 가루류(박력분과 베이킹파우더, 소금)에 부어준다. ④ 반죽을 잘 섞은 다음 반으로 나누어 한쪽에는 녹차가루를 넣어 잘 섞어준다. ⑤ 나머지 반에는 초콜릿 녹인 것을 넣는데, 이 때 살짝 데운우유에 코코아가루를 섞어 함께 넣어준다. ⑥ 두 개의 반죽이 완성되면 틀에 유산지를 깔고 반죽을 조금씩 넣어준다. 이쑤시개를 이용해 저어준다. ⑦ 180℃로 예열된 오븐에서 20분 가량 구워준다. ⑧ 실온의 말랑말랑한 버터를 섞어주고 여기에 크림치즈를 넣어 섞어준다. ⑨ 슈가파우더를 넣고 휘핑해준다. 반을 덜어서 녹차가루를 넣어 녹차크림치즈를 만들어준다. ⑩ 컵케이크 위에 크림치즈 프로스팅을 올려준다.",,2022-10-30
녹차 초콜릿 타르트,"구운 3호 타르트지 1개, 생크림 100g, 화이트 커버처 초콜릿 180g, 물엿 10g, 녹차가루 10g, 버터 30g",,"① 작은 냄비에 생크림, 물엿을 넣고 중불에 끓여준다. 가장자리가 살짝 끓어 오르면 불을 꺼준다. ② 화이트 커버처 초콜릿을 넣어준다. ③ 주걱으로 저어 녹여준다. (초콜릿에 물이 들어가지 않도록 주의한다.) ④ 체 친 녹차가루를 넣어준다. 재빠르게 거품기로 저어준다. ⑤ 버터를 넣고 저어주며 녹여준다. (잘 녹지 않으면 가스레인지 불에 살짝 데워 녹여준다.) ⑥ 녹차 초콜릿 필링을 완성하면 준비해 둔 타르트지에 부어주고 냉장고에 4~5시간 굳혀준다. ⑦ 준비한 피스타치오를 적당한 크기로 다져준다. ⑧ 냉장고에서 꺼낸 타르트 윗면에 피스타치오를 올려준다.",피스타치오를 굳히기 전에 올려주면 떨어지지 않는다.,2022-10-30
녹차 치즈 타르트,"다이제스티브 과자 60g, 버터 15g, 크림치즈 150g, 생크림 60g, 달걀 1개, 레몬즙 1작은술, 박력분 1큰술",설탕 45g,"① 크림치즈와 버터, 달걀은 실온에 꺼내 두어 차갑지 않은 상태로 만들어준다. ② 다이제스티브 과자를 곱게 가루로 만들어준다. 녹인 버터를 넣고 잘 섞은 후 유산지를 깐 틀에 넣어준다. ③ 숟가락을 이용해서 꾹꾹 눌러 평평하게 만든 후 냉장고에서 굳혀준다. ④ 볼에 크림치즈를 담고 핸드믹서로 1단에서 부드럽게 풀어준다. ⑤ 설탕을 넣고 핸드믹서로 잘 섞어준다. ⑥ 달걀을 넣고 핸드믹서로 부드러운 상태가 될 때까지 믹싱해준다. ⑦ 레몬즙과 박력분, 가루녹차를 넣고 잘 섞어준다. ⑧ 다른 볼에 생크림을 넣고 부드러운 상태로 휘핑을 해준다. ⑨ 치즈반죽에 생크림을 넣고 잘 섞어준다. ⑩ 틀에 반죽을 담은 후 170℃로 예열된 오븐에서 약 35분 정도 구워준다.",,2022-10-30
녹차 치즈 팥 케이크,"스펀지케이크 1판, 녹차크림(크림치즈 120g, 생크림 120ml, 설탕 40g, 녹차파우더 7g, 젤라틴5g), 치즈크림(크림치즈 120g, 생크림 120ml, 설탕 30g, 젤라틴 5g), 팥크림(팥앙금 170g, 생크림 120g, 젤라틴 5g)","토핑(생크림 200ml, 설탕 15g, 녹차파우더)","① 토핑용 생크림에 설탕을 넣고 믹서로 70% 정도 휘핑해놓는다. ② 치즈크림-크림치즈, 설탕을 중탕하고 생크림과 젤라틴을 섞어준다. ③ 녹차크림-크림치즈, 설탕을 중탕하고 생크림, 녹차파우더, 젤라틴을 섞어준다. ④ 팥크림- 팥앙금, 생크림을 중탕하고 젤라틴을 섞어준다. ⑤ 스펀지케이크를 조각내 그릇에 랩을 깔고 케이크를 깐다. ⑥ ⑤에 치즈크림, 녹차크림, 팥크림의 순서대로 부어 굳혀준다. ⑦ 생크림으로 코팅하고, 녹차파우더를 장식한다.",분량: 4인분 기준 조리시간: 90분 이내,2022-10-30
녹차 카스테라,"박력분 400g, 가루녹차 20g, 계란 12개, 우유 120g","청주 60g, 바닐라익스트랙 4g, 꿀 60g, 소금 2g, 설탕 180g","① 박력분과 녹차가루는 미리 세번 체 쳐준다. ② 계란은 흰자, 노른자를 분리하여 흰자는 냉장고에 넣어두고 노른자는 볼에 넣어 잘 섞어준다. ③ 미리 실온에 두었던 우유를 넣고 섞어준다. ④ 청주나 맛술도 섞어준다. ⑤ 바닐라익스트랙을 넣어준다. ⑥ 꿀과 소금도 넣고 잘 섞어준다. ⑦ 설탕을 수차례 나누어 넣어가며 머랭을 쳐준다. ⑧ 머랭이 다 쳐졌으면 노른자 섞어놓은 볼에 잘 섞일 수 있도록 일부를 덜어서 잘 섞어준 후, 머랭에 모두 부어 섞어준다. ⑨ 가루는 날가루가 보이지 않도록 잘 흩어가며, 바닥까지 긁어 퍼올리며 섞어준다. ⑩ 유산지(테프론시트)를 깔아놓은 팬에 골고루 팬닝한 후 표면을 평평하게 스크래퍼 등으로 정리해준다. ⑪ 오븐에 넣기 직전 바닥에 탕탕 쳐서 기포를 빼주고 미리 180℃로 예열해 둔 오븐에 30분 가량 구워준다. ⑫ 다 구워진 시트는 팬째로 한김 식힌 후 빼준다.",,2022-10-30
녹차 카스테라,"박력분 100g, 달걀 4개, 설탕 90g, 녹차가루 6g, 우유 25g, 꿀 10g, 버터 15g",,"① 핸드믹서로 달걀 흰자를 풀어준다. ② 설탕을 조금씩 넣고 휘핑한 다음 머랭이 단단하게 올라오면 저속에서 1분간 돌려 조밀한 머랭을 만들어준다. ③ 달걀 노른자를 넣고 저속에서 1분간 휘핑해준다. ④ 체에 내린 박력분, 녹차가루를 넣고 가볍게 잘 섞어준다. ⑤ 볼에 버터, 꿀, 우유를 담고 전자레인지에서 30초간 데워 반죽을 한 주걱 크게 떠서 반죽이 완전히 풀어질 때까지 섞어준다. ⑥ 나무틀 옆면에 유산지를 두르고 반죽을 부은 다음, 나무젓가락으로 반죽을 저어 기포를 빼주고 170℃로 예열한 오븐에서 15분간 굽고, 온도를 160℃로 내려 25분 더 구워준다.",,2022-10-30
녹차 컵케이크,"컵케이크재료(버터 120g, 설탕 170g, 소금 2g, 계란 2개, 박력분 180g, 베이킹파우더 6g, 녹차가루 7g, 우유 125g, 팥앙금 135g), 녹차크림치즈프로스팅(크림치즈 200g, 버터 80g, 슈가파우더 200g, 녹차가루 1작은술)",,"① 버터, 계란, 우유는 실온에 미리 꺼내둔다. 머핀팬에 유산지컵을 끼워준다. 팥앙금은 15g씩 분할해 동그랗게 만들어준다. 박력분, 베이킹파우도, 녹차가루는 체 쳐준다. 오븐은 180℃로 예열해준다. ② 실온에 둔 버터를 부드럽게 풀고 소금, 설탕을 2회 나눠 넣어 충분히 섞어준다. ③ 체 친 박력분, 베이킹파우더, 녹차가루를 ⅓ 넣어 섞고, 우유 ½ 넣어 섞고, 가루 ⅓-우유 ⅓-가루 ⅓ 순으로 넣어 섞어준다. ④ 완성된 반줄을 짤주머니에 담아 바닥에 1~2cm 높이로 채우고 팥앙금을 넣고 다시 반죽을 70%까지 채워준다. ⑤ 180℃로 예열한 오븐에 25~30분 정도 구워 틀에서 한김 식힌 후 꺼내어 충분히 식혀준다. ⑥ 녹차 크림치즈 프로스팅: 실온상태의 크림치즈와 버터를 풀어주고 슈가파우더를 조금씩 나눠 넣고 섞어준다. 녹차가루를 넣어 섞어준다. ⑦ 완성된 크림을 컵케이크 위에 스페츌러를 이용해 올려준다.",,2022-10-30
녹차 콩배기 식빵,"강력분 250g, 우유 100g, 달걀 1개, 소금 3g, 설탕 20g, 무염버터 30g, 드라이이스트 5g, 녹차가루 8g, 콩배기150g",,"① 반죽기에 체에 친 강력분, 설탕, 소금, 녹차가루, 드라이이스트를 제빵기 틀에 넣어준다. 이때 소금과 설탕이 드라이이스트에 닿지 않게 해준다. ② 따뜻한 상태의 우유와 달걀을 넣고 반죽해준다. ③ 반죽이 한덩어리가 되면 실온상태의 버터를 넣어 다시 반죽하고 1차 발효를 시켜준다. ④ 손으로 눌러 보았을 때 형태의 변화가 없으면 발효가 된 것이다. ⑤ 반죽을 똑같은 무게로 3등분 해준다. ⑥ 양손으로 동글리기를 하여 가스를 빼준 후 비닐 랩을 덮어 10분 정도 중간 발효를 해준다. ⑦ 반죽을 밀대로 길게 민 후 콩배기를 올리고, 양쪽 끝을 접은 후 돌돌 말아준다. 끝이 풀리지 않도록 손으로 꼬집어준다. ⑧ 봉합한 부분이 아래로 가게 하고 일정한 간격으로 식빵 틀에 담아준다. ⑨ 면보나 랩을 씌운 후 따뜻한 곳에서 40~50분 정도 2차 발효를 해준다. 2배 정도 부풀면 된다. ⑩ 180℃로 예열한 오븐에서 약 19~20분 정도 구워준다.",,2022-10-30
녹차 쿠키,"밀가루 중력분 180g, 밀가루 박력분 220g, 말차가루 28g, 베이킹파우더 10g, 버터 220g, 갈색설탕 180g, 물엿 20g, 소금 1꼬집, 계란 110g","화이트 또는 다크초콜릿 청크 60g, 견과류 60g","① 중력분, 박력분, 말차가루, 베이킹파우더는 한 데 섞은 뒤 체에 한번 내려준다. ② 계란은 미리 풀지 않아도 상관없지만 실온에 미리 꺼내준다. ③ 버터도 실온에 꺼내두어 부드럽게 풀어준다. ④ 초콜릿과 견과류는 한 데 계량해두고 호두나 캐슈넛 사용 시 반으로 잘라서 사용해준다. ⑤ 버터에 설탕, 소금을 넣고 아이보리색이 날 때까지 풀어준다. ⑥ 계란을 조금씩 넣어가며 믹싱해 설탕이 다 녹을 때까지 풀어준다.(계란을 한번에 다 넣으면 분리되니 조금씩 넣어가며 잘 섞이도록 해준다.) ⑦ 계란이 잘 섞이고 반죽이 부드러워지면 가루재료를 넣어준다. ⑧ 체 친 가루를 반죽에 모두 넣고 자르듯이 섞어준다. ⑨ 초콜릿과 견과류를 넣고 가볍게 섞은 뒤 비닐을 덮어 냉장고에 한시간 정도 휴지시켜준다. ⑩ 한시간 뒤 꺼낸 반죽은 크게 만들기 위해서는 85g 정도, 조금 작게 만들기 위해서는 40g 정도로 분할해준다. ⑪ 분할한 반죽은 대강 한덩어리로 둥굴려 둔다. ⑫ 팬에 반죽을 올리고 살짝 눌러 둥굴넙쩍한 형태를 만들며 팬닝해준다. ⑬ 오븐은 150℃로 15~16분을 구워준다.",,2022-10-30
녹차 크랙쿠키,"박력분 90g, 계란 1개, 버터 또는 식용유 50g, 녹차가루 20g, 베이킹파우더 3g, 설탕 50g","설탕 약간, 슈가파우더","① 버터 또는 식용유에 설탕 50g을 넣고 잘 섞이게 부드럽게 풀어준다. ② 계란을 넣고 섞어준다. ③ 박력분, 베이킹파우더, 녹차가루를 모두 넣고 체로 쳐서 ②번에 넣고 잘 섞어준다. ④ 반죽을 20g씩 분할해준다. ⑤ 설탕, 슈가파우더를 묻혀준다. ⑥ 170℃의 오븐에서 15분 정도 구워준다.",분량: 6인분 이상(쿠키20g짜리 10~13개 분량) 조리시간: 30분 이내 요리팁: 슈가파우더 묻히기 전에 설탕을 묻혀주면 구울 때 슈가파우더가 녹는걸 방지할 수 있다.,2022-10-30
녹차 크랜베리 구운 도너츠,"우리밀 중력분 120g, 말차가루 1ts, 베이킹파우더 2g, 달걀 1개, 비정제황설탕 50g, 꿀 30g, 소금 1꼬집, 우유 60cc, 녹인버터 35g, 건조크랜베리 40g",장식용 화이트커버처 적당량,"① 달걀을 볼에 넣어서 멍울 없이 풀어준 다음, 설탕, 꿀, 소금을 넣어서 휘핑해준다. (노란 반죽이 아이보리색이 되고, 풍성하게 거품이 날 때까지 휘핑해준다.) ② 여기에 우유를 넣어가며 고루 잘 섞어주고, 체에 내린 가루류를 넣어서 거품기로 섞어준다. ③ 반죽이 매끈하게 섞이면 녹인 버터에 반죽을 한국자 정도 덜어넣고 섞어준다. ④ 버터와 반죽 섞은 것을 본반죽에 넣어서 고무주걱을 이용해 고루 섞어준다. ⑤ 건조크랜베리를 넣어 가볍게 섞은 다음, 반죽을 짤주머니에 넣어서 준비해준다. ⑥ 달군 도넛메이커에 식용유를 발라주고, 반죽을 짜 넣어 뚜껑을 덮고 7분 정도 구워준다. ⑦ 일반 도넛틀에 굽는 경우 190℃ 오븐에 넣어 12~13분 정도 구워준다. ⑧ 구워낸 도넛은 식힘망에 얹어서 식혀준다. ⑨ 화이트초콜릿을 중탕으로 녹여서 도넛 위에 얹어준다.",,2022-10-30
녹차 크렌베리 사브레,"버터 80g, 슈가파우더 70g, 계란노른자(큰사이즈) 1개, 물 1T, 박력분 150g, 녹차가루 3g, 설탕 적당량","쿠키에 발라줄 계란흰자 조금, 크렌베리 ½컵","① 실온에 보관한 말랑말랑한 버터에 슈가파우더를 넣어 휘핑해준다. ② 계란 노른자를 넣고 고속 휘핑하고 뽀얗게 크림화가 되면 녹차가루와 박력분을 함께 섞어 두번 이상 체에 쳐서 넣고, 물도 한큰술 넣고 주걱으로 가볍게 섞어준 후 크렌베리를 넣어 섞어준다. ③ 종이호일이나 비닐에 반죽을 싸서 다 쓴 랩심에 넣고 냉동실에 한시간 이상 얼려둔다. ④ 얼려둔 반죽 표면에 계란 흰자를 발라주고 설탕을 묻혀준 후 칼로 0.7~0.8mm 두께로 잘라준다. ⑤ 종이호일을 깔아둔 베이킹팬에 간격을 두고 올려준 후 180℃ 오븐에서 15분간 구워준다. ⑥ 쿠키는 구운 후 식힘망에 올려 식혀준다.",6인분 기준 120분 이내 완성,2022-10-30
녹차 크림치즈 단팥 카나페,"크림치즈 100g, 녹차가루 4g, 설탕 1ts, 단팥앙금","비스킷 1개, 칵테일새우","① 크림치즈에 녹차가루와 설탕을 넣고 잘 섞어준다.  ② 잘 섞인 크림치즈는 일회용 비닐에 담고, 비닐 끝부분을 살짝 잘라준다. ③ 칵테일새우는 끓는 물에 살짝 데쳐준다. ④ 해태 아이비 비스킷 위에 녹차크림치즈스프레드를 짜준다. 원하는 모양이 있으면 만들어준다. ⑤ 녹차크림치즈 위에 단팥을 올려준다. ⑥ 데친 칵테일새우를 올려준다. ",,2022-10-30
녹차 크림치즈 샌드 쿠키,"무염버터 60g, 설탕 35g, 노른자(L) 1개, 박력분 103g, 녹차파우더 7g, 아몬드가루 10g, 건크랜베리 25g","[샌드크림] 크림치즈 60g, 슈가파우더 15g, 바닐라익스트랙(또는 럼) 1tsp","① 건크랜베리에 물을 넉넉하게 붓고 30분간 불려준다. ② 30분 후 불린 건크랜베리를 키친타올로 꾹꾹 눌러 남은 물기를 없애준다. ③ 곱게 다져준다. ④ 볼에 말랑한 버터를 넣고 부드럽게 풀어준 다음 설탕을 넣고 충분히 섞어준다. ⑤ 노른자를 넣고 잘 섞어준다. ⑥ 박력분, 녹차가루, 아몬드가루를 체에 내려준다. ⑦ 주걱으로 가르듯이 섞어 반죽이 보슬보슬해지면 다진 크랜베리를 넣고 대충 섞어준다. ⑧ 반죽을 가볍게 한덩어리로 뭉쳐준다. ⑨ 완성된 반죽은 랩 또는 비닐에 담아 냉장고에 30분간 휴지시켜준다. ⑩ 휴지가 끝나면 반죽을 0.4cm 두께로 밀어준다. ⑪ 반죽이 굳어서 밀 때 부서지면 실온에 5~10분 정도 두었다가 밀어준다. ⑫ 원하는 쿠키커터로 찍어준다. ⑬ 160℃로 예열한 오븐에 10~15분 정도 구워준다. ⑭ 구운 색이 진하게 나오지 않도록 조심한다. ⑮ 쿠키는 오븐팬 위에 그대로 식혀준다.   열기가 좀 식었으면 식힘망에 올려 마저 식혀준다.  [크림]  ① 볼에 말랑한 크림치즈를 넣고 부드럽게 풀어준다. ② 슈가파우더와 바닐라익스트랙(또는 럼)을 넣고 잘 섞어준다. ③ 바닐라익스트랙이나 럼은 생략해도 된다.(넣으면 풍미가 좋다.) ④ 완성된 크림은 짤주머니에 담아서 사용하거나 잼나이프를 사용해 발라준다. ⑤ 크림을 처음부터 넓게 바르지 말고 작고 도톰하게 채워서 쿠키로 지긋이 눌러준다. (넓게 바를 경우 얇게 발라준다.) ⑥ 크림을 체웠으면 냉장고에 넣어준다.",,2022-10-30
녹차 크림치즈 프로스팅 초코 컵케이크,"버터 80g, 다그커버춰 40g, 설탕 70g, 소금 약간, 계란 1개, 박력분 33g, 코코아가루 8g, 베이킹파우더 2g","녹차 크림치즈 프로스팅: 크림치즈 100g, 버터 40g, 슈가파우더 100g, 녹차가루 1Ts","① 박력분, 베이킹파우더, 코코아가루를 두번 체 쳐준다. ② 계란, 크림치즈, 버터를 실온에 미리 꺼내둔다. ③ 오븐은 180℃로 예열한다. ④ 버터와 다크커버처를 중탕으로 녹이고 소금, 설탕을 넣어 녹여준다. ⑤ 풀어준 계란을 넣고 섞어준다. ⑥ 체 친 박력분, 코코아가루, 베이킹파우더를 넣어 살살 섞어준다. ⑦ 완성된 반죽을 ⅔ 정도 담고 180℃로 예열한 오븐에 20~22분간 구워준다. ⑧ 크림치즈와 버터를 부드럽게 풀고 슈가파우더를 조금씩 여러 차례 나눠넣으며 섞어준다. ⑨ 크림이 부드럽게 섞이면 녹차가루를 넣어 섞어준다. ⑩ 완성된 크림을 깍지낀 짤주머니에 담아 충분히 식힌 컵케이크 위에 짜준다.",,2022-10-30
녹차 크림치즈머핀,"박력분 120g, 설탕 90g, 달걀(실온) 2개, 베이킹파우더 3g, 휘핑크림 80g, 무염버터(실온) 100g, 녹차분말가루 15g, 우유5 0ml, 크림치즈 적당량, 소금 2g",,"① 믹싱볼에 실온에서 1시간 이상 보관해서 부드러워진 무염버터 100g을 휘핑기로 부드럽게 풀어준다. ② 설탕 90g을 두 번에 나눠 넣어서 버터와 함께 설탕의 가루가 보이지 않을 때까지 잘 섞어준다. ③ 실온에서 1시간 이상 보관한 달걀 2개도 하나씩 나누어서 넣고 빠르게 섞어준다. ④ 소금 2g을 넣고 잘 섞어준다. 오븐 예열은 170℃에서 15분 정도 예열해준다. ⑤ 박력분 120g, 녹차 분말가루 15g, 베이킹파우더 3g을 체반에 곱게 체 쳐준다. ⑥ 고무주걱을 이용하여 골고루 잘 섞어준다. ⑦ 반죽을 대충 섞고 우유 50ml를 넣어 부드럽게 잘 섞어준다. ⑧ 반죽을 짤주머니에 담아준다. ⑨ 머핀틀에 컵유산지를 깔고 녹차반죽을 머핀틀의 50% 정도만 채워준다. 그리고 그 위에 크림치즈를 넣고 싶은 양만큼 듬뿍 올려준다. ⑩ 크림치즈를 올리고 나서 다시 한 번 그 위에 녹차반죽을 짜준다. 녹차반죽은 머핀틀을 기준으로 80%까지만 채워준다. 오븐에 넣고 170℃에서 15분 구워준다.",분량: 4인분 기준 조리시간: 60분 이내,2022-10-30
녹차 크림치즈빵,"건무화과발효종 300g, 세몰리나듀럼밀 300g, 우유 63ml, 생크림 25ml, 계란 50g, 소금 3~4g, 원당 45g, 무염버터 45g, 검정깨 5g, 녹차가루 5g ","[토핑] 계란흰자 35g, 아몬드가루 30g, 슈가파우더 30g [충전물] 크림치즈 400g, 슈가파우더 45g, 레몬즙 약간","① 버터 외에 모든 재료를 섞어 하나로 뭉쳐지면 버터를 넣고 매끄럽게 될 때까지 치대며 반죽해준다. ② 1차 발효(실온 26℃, 3~4시간)해준다. ③ 65g씩 분할하여 둥글리기 후 20분 휴지해준다. ④ 재둥글리기를 하고, 성형해준다. ⑤ 크림치즈 충전물을 안에 넣고 원하는 모양대로 성형해준다. ⑥ 2차 발효(약 90분, 30~34℃, 습도80%)를 하고, 2배 부풀 때까지 기다려준다. ⑦ 덧가루로 듀럼밀가루를 윗면에 체로 받쳐 뿌려준 후 원하는대로 칼집을 넣어준다. ⑧ 토핑을 짤주머니에 넣어서 짜준다. ⑨ 계란흰자 35g+아몬드가루 30g+슈가퍼우더 30g, 계란흰자는 멍울만 풀어주고 가루류를 체 쳐 넣어 섞어준다. ⑩ 예열 후 180℃에서 20~25분간 구워준다.",,2022-10-30
녹차 크림치즈빵,"강력분 250g, 설탕 3큰술, 소금 1작은술, 드라이이스트 1작은술, 달걀 1개, 버터 30g, 녹차가루 1+½큰술, 물 115ml, 크림치즈 200g",호박씨 약간,"① 1차 발효가 끝나면 손으로 반죽을 눌러 가스를 빼주고 8등분 해 둥글리기 해준다. ② 반죽에 비닐이나 랩을 씌워 15분간 중간 발효를 해준다. ③ 반죽을 밀대나 손바닥으로 납작하게 만든 다음, 거품기로 부드럽게 풀어둔 크림치즈를 올려준다. ④ 속재료가 보이지 않게 반죽 끝부분을 꼭꼭 집어준다. ⑤ 버터나 기름을 바른 머핀팬에 반죽을 넣어 호박씨로 장식을 한 다음 50분간 2차 발효를 해준다. ⑥ 반죽이 두배로 부풀어 오르면 180℃로 예열한 오븐에서 15분간 구워준다.",,2022-10-30
녹차 티라미수,"마스카포네치즈 125g, 생크림 125g, 설탕 40g, 녹차가루 5g, 레이디핑거 10~12개","커피시럽(물 150ml, 인스턴트커피 4봉)",① 녹차가루와 설탕을 섞어준다. ② 생크림에 녹차설탕을 3번에 나눠가며 핸드믹서를 이용해서 휘핑해준다. 핸드믹서 거품기를 들어올렸을 때 생크림 뿔이 생기는 정도로 휘핑해준다. ③ 마스카포네치즈를 넣고 부드럽게 잘 섞어준다. ④ 완성된 녹차크림은 컵에 짤주머니를 끼우고 담아준다. ⑤ 차갑게 식혀둔 커피시럽에 레이디핑거를 담갔다 빼준다. ⑥ 레이디핑거 위에 녹차크림을 짤주머니를 이용해서 짜준다. 레이디핑거를 다시 올리고 녹차크림의 순서로 올려준다. ⑦ 녹차가루를 체를 이용해서 뿌려준다.,분량: 2인분 기준 조리시간: 30분 이내,2022-10-30
녹차 티라미수,"카스테라 (20*10cm) 1개, 크림치즈 250g, 설탕 80g, 생크림 150g, 레몬즙 1t, 녹차가루 3큰술, 온수 2T","녹차 1T, 설탕 1T, 오렌지술 1T, 체리 15개","① 온수에 녹차, 설탕을 넣고 섞어서 시럽을 만들어준다. 시럽에 럼주나 꼬엥트로 같은 오렌지술을 넣어주면 향기가 좋아진다. ② 락앤락글라스 용기 바닥에 카스테라를 잘라 넣고 시럽을 요리용 붓으로 발라준다. ③ 실온크림치즈에 레시피 반분량(40g)의 설탕을 넣고 섞어주고 생크림에도 설탕(40g)을 넣어 70~80% 정도로 부드럽게 휘핑해준다. 생크림과 크림치즈를 혼합해서 섞어준다. 무스틀이나 선물용으로 만드는 경우 판젤라틴 1장을 중탕으로 녹여서 휘핑한 생크림에 넣고 섞어준다. ④ 시럽을 발라준 카스테라 위에 병조림체리를 반으로 잘라서 키친타올로 물기를 빼서 올려두고 크림을 짤주머니에 담아 체리 사이사이에 짜서 채워넣고 고무주걱으로 평평하게 펴준 후 다시 카스테라를 올리고 시럽을 바르고 크림을 바르고를 반복한 후 랩이나 용기 뚜껑을 덮어 냉장고에 한시간 이상 보관해둔다. 먹기 직전에 녹차가루를 체에 넣고 뿌리고 체리를 장식한다.",2인분 기준 60분 이내 완성,2022-10-30
녹차 파베초콜릿,"다크초콜릿 330g, 생크림 110g, 녹차가루 약간",,"① 초콜릿과 생크림을 뜨거운물에 중탕해서 잘 섞어가며 녹여준다. ② 사각형 모양의 틀 바닥에 호일이나 비닐을 씌우고, 녹은 초콜릿을 붓고 바닥에 살짝 내리쳐 윗면을 평평하게 해준다. ③ 그 상태로 차가운 곳에서 최소 30분 이상 초콜릿을 굳혀준다. 초콜릿이 완벽히 굳으면 틀에서 떼어내 비닐을 벗기고 적당한 사이즈로 일정하게 잘라준다. ④ 비닐봉투에 초콜릿과 녹차가루를 넣어 잘 묻도록 흔들어준다.",분량: 4인분 기준 조리시간: 60분 이내 요리팁: 사각형 모양 틀이 없다면 사각 락앤락 통에 비닐을 깔고 굳혀도 된다.,2022-10-30
녹차 파베초콜릿,"청정원½쿠킹스위트, 화이트초콜릿 200g, 녹차가루, 생크림 100g",녹차코코넛분말,"① 큰 그릇에 뜨거운물을 담은 후, 작은 그릇에 생크림 100g과 화이트초콜릿 200g을 중탕한 후 녹차가루를 1스푼 넣어 섞어준다. ② 초콜릿이 용기에 붙지 않도록 용기 안쪽에 랩핑을 해준 후, 녹인 화이트 녹차 초콜릿을 부어 냉동실에서 굳혀준다. ③ 녹차가루에 청정원 ½쿠킹스위트를 넣고 곱게 갈아준다. ④ 굳은 초콜릿을 뒤집어 꺼낸 뒤, 뜨거운물에 칼을 담가 작은 크기로 잘라준다. ⑤ 곱게 갈은 녹차가루, 녹차코코넛분말에 잘 굴려 묻혀준 후, 슈가파우더로 데코해준다.",분량: 2인분 기준 조리시간: 30분 이내 요리팁: 칼을 뜨거운물에 담갔다 빼서 사용하면 초콜릿이 붙지 않고 잘 썰어진다.,2022-10-30
녹차 파운드 케이크,"버터 150g, 설탕 100g, 계란 3개, 박력분 180g, 녹차가루 12g, 소금 2g, 베이킹파우더 2g",,"① 실온에 두어 말랑해진 버터를 푼 뒤, 설탕을 넣고 크림화시켜준다. ② 계란도 나눠 넣어가며 섞어준다. ③ 박력분, 녹차가루, 소금, 베이킹파우더를 체 쳐 넣고 섞어준다. ④ 식용유 또는 버터를 바른 틀에 반죽을 담는다. ⑤ 170°C 온도의 오븐에서 25~30분간 구워준다.",6인분 이상 60분 이내 완성,2022-10-30
