요리명,주재료,부재료,조리법 ,상세설명,데이터기준일자
초콜릿 녹차머핀," 무염버터 200g, 설탕 120g, 소금 1g, 계란 120g, 박력분 280g, 녹차파우더 30g, 우유 120g, 다크초콜릿 240g",녹색식용색소 약간,"① 버터를 부드럽게 풀어준다. ② 소금, 설탕을 넣고 크림화해준다. ③ 계란을 나누어 넣어주며 섞어준다. ④ 체 친 박력분, 베이킹파우더, 녹차파우더를 넣고 섞어준다. ⑤ 날가루가 거의 다 섞일 때쯤 우유를 넣고 섞어준다. ⑥ 오븐을 미리 예열해준다. ⑦ 다크초콜릿을 잘라준다. ⑧ 머핀틀에 유산지를 깔고 반죽과 초콜릿을 번갈아 넣어준다. ⑨ 예열해둔 165℃ 오븐에 25분 구워준다.","보관방법: 상온 2일 이내, 냉동고 개별포장 후 밀봉하여 보관해준다. 먹을 때는 상온해동 또는 전자레인지에 돌려먹으면 초콜릿이 녹아 맛있다.",2022-10-30
칡 녹차 더덕무침,"녹차 ½큰술, 더덕 4~5뿌리, 칡효소 2큰술, 녹차소금 약간, 홍고추 1개","양념장: 간장 1큰술, 생강청 1큰술, 조청 1큰술, 설탕 ½작은술, 식초 1큰술, 참기름 약간, 통깨 약간",① 녹차는 물에 불려주었다가 물기를 완전히 제거해준다. ② 더덕은 곱게 채썰어 녹차소금물에 살짝 절여준다. 녹차소금물에 살짝 절여준 더덕을 칡 효소에 담구어 색을 내어준다. ③ 홍고추는 곱게 채썰어서 냉수에 담구어 색을 빼준다. ④ 참기름을 뺀 나머지 재료로 양념장을 만들어준다. ⑤ 칡효소에 담가진 더덕을 키친타올로 이용해 물기를 빼준다. ⑥ 더덕을 양념장에 버무려준다. 양념장에 버무린 더덕과 녹차잎을 다시 한 번 살짝 버무려주고 이때 참기름을 첨가해 버무려준다. ⑦ 접시에 버무린 녹차 더덕무침을 담아주고 홍고추를 올려준다.,,2022-10-30
크리스마스 녹차 컵케이크,"버터 60g, 설탕 80g, 노른자 1개, 바닐라익스트랙 1ts, 박력분 90g, 베이킹파우더 3g, 녹차(말차가루) 4g, 우유 45g ","생크림 200ml, 설탕 40g, 데코용슈가파우더 적당량","① 실온에 두었던 버터를 핸드믹서를 이용해 풀어주고 설탕을 넣어, 설탕이 다 녹을 때까지 휘핑해준다. ② 계란을 조금씩 넣어, 버터와 분리되지 않도록 섞은 후 바닐라익스트랙을 넣어 섞어준다. ③ 한 데 모아 체 쳐둔 가루 중 반을 넣어 주걱으로 가르듯 섞은 후 미지근한 정도의 우유를 넣고 섞어준다. ④ 그 후 나머지 가루를 넣어 섞어준다. ⑤ 머핀틀에 유산지를 넣고 약 80% 정도 채운 후 170℃로 예열된 오븐에서 약 20~25분간 구워준다. ⑥ 꼬지로 찔러보아 묻어나오지 않도록 구워준다. ⑦ 식힘망에서 충분히 식혀준다. ⑧ 차가운상태의 생크림을 휘핑하다가 설탕을 넣고 단단하게 휘핑해준다. ⑨ 컵케이크 위에 봉긋한 봉오리 모양으로 생크림을 프로스팅한 후 분당체를 이용해 데코용 슈가파우더를 뿌려준다.","버터와 계란, 우유는 실온에 1시간 정도 꺼내두어 찬기를 없애둔다. 가루류는 잘 섞어 2번 가량 미리 체 쳐둔다.",2022-10-30
크림치즈 녹차 머핀,"크림치즈 260g, 설탕 40g, 우유 60g, 달걀 2개, 레몬즙 2Ts, 옥수수전분 25g",녹차쿠키,① 구워 식힌 쿠키는 비닐봉지에 넣고 밀대로 살살 부숴준다. ② 부숴놓은 쿠키는 머핀컵에 ⅓ 정도 담아준다. ③ 나머지 ⅔는 만들어 놓은 크림치즈 반죽으로 채워준다. ④ 크림치즈 반죽은 구워지는 과정에서 부풀거나 넘치지 않기 때문에 머핀컵 가득 부어준다. ⑤ 180℃로 예열한 오븐에서 20~35분간 크림치즈 반죽이 찰랑거리지 않고 굳을 때까지 구워준다.,,2022-10-30
탱글탱글한 녹차젤리,"녹차가루 3g, 젤라틴가루 2g, 설탕 15g, 뜨거운물 100g, 찬물 600g ","우유, 연유, 팥조림(팥빙수팥가능)","① 볼에 녹차가루와 젤라틴가루, 설탕을 넣고 섞어준다. ② 뜨거운물을 넣어 녹차가루를 뭉치지 않도록 섞고 젤라틴을 녹여준다. ③ 찬물도 넣어서 농도를 맞추어준다. ④ 만든 젤리를 적당한 틀에 넣어 냉장고에서 탱글하게 굳혀준다. 중간에 가라앉은 녹차가루가 없도록 한번 저어준다. ⑤ 세팅할 때는 투명한 유리컵이나 입구가 넓은 유리컵에 제멋대로 젤리를 뜨고 우유를 붓고 팥조림을 동그랗게 얹어준다.",2인분 기준 60분 소요,2022-10-30
통밀 녹차식빵,"통밀 450g, 녹차가루 20g","올리브유 20g, 소금 6g, 물 230g, 설탕 20g, 이스트 8g, 견과류 취향껏","① 미지근한 물에 이스트를 넣고 녹여준다. ② 통밀가루에 소금, 설탕을 겹치지 않게 넣고 녹차가루, 올리브오일까지 뿌려준다. ③ 그 위에 이스트 섞은 물을 부어주고 열심히 반죽을 해준다. ④ 반죽이 되면, 따뜻한 장소에서 1차 발효를 60분간 해준다. ⑤ 발효된 반죽을 두 덩어리로 나눈 뒤 20분간 중간 발효를 시켜준다. (실온 또는 물과 함께 오븐에 넣어 밀폐) ⑥ 공기를 빼고 밀대로 밀어준다. ⑦ 그 위에 토핑 재료들을 올려준다. ⑧ 세로로 양 옆을 접고, 가로로 양 옆을 돌돌 말아준다. 끝부분은 잘 여며준다. ⑨ 식빵틀에 넣고 40분 정도 더 발효를 시켜준다. ⑩ 2차 발효가 끝나면 180℃로 예열한 오븐에 30분 정도 구워준다.",분량: 6인분 이상 조리시간: 2시간 이상 요리팁: 토핑은 생략해도 된다.,2022-10-30
티메이커를 이용한 녹차라떼,"녹차가루 2T, 우유 1개","설탕 취향껏, 얼음(생략가능)","① 컵에 녹차분말, 설탕을 넣고 뜨거운물을 부어 풀어준다. 물은 녹차가루 풀기용으로 아주 조금만 넣어준다. ② 커피/티메이커에 우유를 부어준다. ③ 뚜껑을 닫고 손잡이를 위아래로 펌핑해준다. 거품 때문에 우유가 넘칠 수 있으니 우유는 용기의 40%만 담아준다. ④ 우유를 조금만 넣어 녹차물과 섞어준다. ⑤ 완성된 우유거품을 천천히 부어준다.",커피/티메이커를 이용하면 시원한 라떼 음료에도 부드러운 우유거품을 맛볼 수 있다.,2022-10-30
팥배기 녹차 머핀,"박력분 130g, 녹차가루 1+⅓큰술, 버터 90g, 베이킹파우더 2/3작은술, 팥배기 150g, 생크림(우유) 5큰술(4큰술), 설탕 60g, 소금 약간",,"① 부드럽게 풀어둔 버터에 분량의 설탕과 소금을 여러 차례 나눠 넣으며 거품기로 녹여준다. ② 달걀을 조금씩 넣어가며 거품기로 섞어준다. ③ 두 번 체에 친 박력분과 녹차가루, 베이킹파우더를 한 번 더 체에 내려 넣고 가볍게 섞어준다. ④ 생크림을 넣고 골고루 섞어준다. ⑤ 토핑용 팥배기를 뺀 나머지 팥배기를 넣고 가볍게 섞어준다. (반죽에 섞일 정도로 살짝만 섞어준다.) ⑥ 머핀 유산지에 반죽을 ⅔ 정도 채워 넣고 팥배기로 토핑을 한 다음, 180℃로 예열한 오븐에서 25~30분간 구워준다.",팥배기가 좀 단 편이니 단 것을 좋아하지 않으면 설탕을 레시피에 나와있는 양보다 조금 적게 해서 넣어준다.,2022-10-30
팥배기 녹차 파운드 케이크,"무염버터 90g, 박력분 100g, 계란 110g, 설탕 80g, 베이킹파우더 3g, 녹차가루 5~8g, 두유 15g, 팥배기 70g",,① 실온 버터를 부드럽게 풀고 설탕을 넣고 충분히 휘핑해준다. ② 계란을 조금씩 나눠 넣으며 휘핑해준다. ③ 박력분 + 베이킹파우더 + 녹차가루를 체 쳐 넣고 주걱을 세워 가르듯 섞어준다. ④ 날가루가 조금 남아있을 때 두유와 팥배기를 넣고 섞어준다. ⑤ 유산지를 깐 틀에 반죽을 채워서 반죽의 양 끝을 주걱으로 끌어올려 정리해준다. ⑥ 칼날에 기름을 바르고 중앙에 칼집을 내준다. ⑦ 170℃ 예열된 오븐에 40~50분 가량 구워준다.,4인분 기준 60이내 완성,2022-10-30
팥앙금 녹차 롤케이크,"[녹차 반죽 재료] 박력분 110g, 달걀 5개, 녹차가루 2큰술, 설탕 90g [코코아 반죽 재료] 박력분 10g, 코코아가루 1작은술, 휘핑한 달걀 노른자 1큰술, 머랭 4큰술","팥앙금 150g, 생크림 300g, 설탕 20g","① 달걀 노른자는 핸드믹서의 가장 센 단계에서 30초간 돌려준다. ② 설탕 45g을 조금씩 넣어가며 거품기를 들어올렸을 때 거품 자국이 남을 때까지 돌려준다. 거품이 풍부하게 올라오면 가장 약한 단계에서 1분간 휘핑해 기포를 없애준다. ③ 달걀 흰자에 설탕 45g을 조금씩 나눠 넣어가며 머랭을 만들어준다. ④ 체에 내린 박력분, 코코아가루, 휘핑한 달걀 노른자, 머랭을 넣고 잘 섞어준다.	 ⑤ 코코아 반죽을 짤주머니에 담아 유산지를 깐 팬에 지름 1.5cm 정도의 크기로 짜준다. 180℃에서 1분간 구워준다. ⑥ 달걀 노른자가 든 볼에 세 번 체에 내린 박력분, 녹차가루, 머랭을 3~4차례로 나눠 섞어준다. 코코아 반죽이 다 구워지면 그 위에 녹차 반죽을 붓고 표면을 평평하게 정리해준다. ⑦ 190℃로 예열한 오븐에서 10분간 구워준다.  ⑧ 생크림에 설탕을 넣고 휘핑해준다. ⑨ 도트무늬가 보이지 않는 쪽을 앞으로 놓고 휘핑한 생크림을 고루 발라준다. ⑩ 그 다음 짤주머니에 담은 팥앙금을 짜준다. ⑪ 시트를 돌돌 만 뒤 냉장고에 넣어 모양을 잡아준다.",생크림은 케이크 아이싱 할 때보다 좀 더 단단하게 내준다.,2022-10-30
팥앙금 녹차 머핀,"박력분 160g, 버터 90g, 우유 50g, 베이킹파우더 1작은술, 달걀 1과½개, 팥앙금 120g ","설탕 85g, 소금 1g, 녹차가루 5g, 올리고당 15g","① 실온 상태의 버터를 부드럽게 풀어준다. ② 설탕과 소금을 조금씩 나눠 넣으며 섞어준다. ③ 달걀과 올리고당을 3번 정도 나눠 넣으며 설탕 입자가 느껴지지 않을 때까지 거품기로 저어준다. 실온 상태의 우유를 넣고 섞어준다. ④ 체에 내린 박력분, 녹차가루, 베이킹파우더를 넣고 섞어준다. 팥앙금을 20g씩 분할해서 동그랗게 빚어준다. ⑤ 틀에 약 절반 정도 올라오도록 반죽을 넣고 팥앙금을 얹어준다. ⑥ 틀의 80% 정도 올라오도록 반죽을 넣고 170℃로 예열한 오븐에서 25분간 구워준다.",,2022-10-30
팥앙금 녹차와플,"강력분 200g, 우유 150g, 버터 35g, 녹차가루 1큰술, 인스턴트드라이이스트 2/3작은술, 달걀 노른자 1개, 팥앙금 220g","설탕 35g, 소금 ⅓작은술","① 강력분이 담긴 볼에 간격을 두고 설탕, 소금, 인스턴트드라이이스트, 녹차가루를 넣어주고 가루 재료를 서로 닿지 않게 강력분으로 코팅해준 다음 달걀 노른자와 우유를 넣고 약 4~5분 정도 반죽해준다. ② 버터를 넣고 표면이 매끈해질 때까지 8~10분 정도 반죽해준다. ③ 반죽을 둥글린 뒤 1시간 동안 1차 발효를 해주고, 1차 발효가 끝나면 반죽을 약 40g씩 둥글리기 한 뒤 15분 동안 중간 발효를 해준다. ④ 중간 발효를 하는 동안 팥앙금을 20g씩 나누어 둥글리기 해주고 반죽을 밀대나 손으로 동글납작하게 밀어준다. ⑤ 반죽 위에 팥앙금을 올려주고 반죽을 잘 오므려 끝이 풀리지 않게 손으로 꼭꼭 이어붙여준다. ⑥ 10분간 2차 발효를 해주고 반죽을 예열한 와플팬이나 와플 메이커에 올리고 노릇노릇하게 구워준다.",,2022-10-30
홈카페 녹차 초코 라테,"녹차가루 3작은술, 끓인물 50ml, 초콜릿시럽 30ml, 녹차아이스크림 1스쿱, 타임(허브잎) 약간, 얼음 ",,① 작은 컵에 녹차가루 3작은술과 끓인물을 50ml 붓고 잘 섞어준다. ② 컵에 초콜릿시럽 30ml를 넣어준다. ③ 얼음을 가득 채우고 우유 100ml를 부어준다. ④ 미리 섞어 준비해 둔 녹차를 넣어준다. ⑤ 녹차 아이스크림을 한 국자 올리고 허브잎으로 장식해준다.,1인분 5분이내 완성,2022-10-30
가루녹차드레싱,가루녹차 2t,"소금 ⅓t, 식초 3t, 꿀 2t, 기름(포도씨유) 6t, 설탕 2t","① 속이 깊은 둥그런 그릇에 소금, 설탕, 가루녹차를 넣고 잘 섞어준다.   ② ①에 기름을 1T씩 넣어가며 저어준다.   ③ 꿀을 따뜻한물 또는 전자레인지에 따뜻할 정도로 만들어 ②에 섞어준다.   ④ 설탕과 소금이 녹았는지 확인한 뒤 식초를 섞어준다.","소스를 많이 만들어 냉장고에 넣어두고 사용할 경우에는 식초를 넣지 말고 ③번까지 만들어 보관한다. TIP : 가루녹차 샐러드 드레싱을 만들 때 가장 주의할 점은 기름을 먼저 넣고 식초를 맨 나중에 넣어야 한다는 것이다. 식초를 먼저 넣으면 녹차가 갈색으로 변하고, 떫은 맛을 준다.",2022-10-30
그린찰떡,"백앙금 60g, 찹쌀가루 100g, 녹차가루 1Ts, 우유 180ml, 베이킹파우더 ½ts, 설탕 3Ts","호두, 밤다이스, 아몬드슬라이스, 호박씨, 해바라기씨 등 견과류","① 볼에 설탕과 녹차가루를 체 쳐 놓는다. ② 달콤한 백앙금을 넣어준 후에 거품기로 앙금과 설탕, 녹차가루가 잘 섞이도록 저어준다. ③ ②에 우유를 넣고 뭉치치 않도록 반죽을 잘 섞어준다. ④ 반죽에 찹쌀가루를 넣고 섞어준다. (주걱으로 들었을 때 살짝 주르륵 흐르는 정도) ⑤ 다진 호두와 밤다이스, 해바라기씨, 호박씨, 아몬드슬라이스 등을 넣어준다. ⑥ 기름칠을 한 틀에 반죽을 부어준다. ⑦ 틀 위에 아몬드슬라이스를 골고루 뿌려주고, 180℃의 오븐에서 40~45분간 구워준다.",,2022-10-30
그린티초코칩비스코티,"중력분 2컵, 녹차가루 2티스푼, 초코칩 100g","베이킹소다 ½티스푼, 소금 1/4티스푼, 계란 두개, 설탕 3/4컵, 녹차우린물 2테이블스푼",① 볼에 계란을 잘 풀어놓은 뒤 설탕을 넣고 저어준다. ② 풀어둔 계란과 설탕에 체에 친 마른 재료를 넣고 날가루가 보이지 않도록 섞어준다. ③ 반죽에 초코칩을 넣고 섞어 준비해준다.  ④ 반죽을 둘로 나눠 넙적하게 모양을 만들어 팬에 올린 뒤 150℃로 예열한 오븐에서 30분간 구워준다. ⑤ 구워준 반죽은 10~15분간 식힌 뒤 빵칼을 이용해  대각선으로 1~1.5cm 정도 두께로 잘라 팬에 올려준다. ⑥ 다시 150℃의 오븐에 넣어 12분간 구워준 뒤 꺼내 식혀준다.,TIP : 반죽을 성형할 때 밀가루를 손에 묻혀서 하면 훨씬 다루기가 편하다. 한번 구워 식히고 써는 동안 오븐은 켠 상태로 150℃를 유지한다.,2022-10-30
녹차 김밥,"찻잎 10g, 쌀 3컵, 김밥용김 4장","햄 4줄, 달걀 3개, 맛살 2개, 당근 1개, 단무지 ⅓개, 식초, 설탕, 소금, 찻물, 식용유","① 찻잎은 따뜻한물에 약 10분간 우려준다. ② 쌀은 30분 정도 불린 후 우려둔 찻물을 붓고 밥을 해준다. ③ 밥에 식초, 설탕, 소금으로 만든 배합초를 잘 섞어준다. ④ 당근은 채썰어 살짝 데쳐준다. ⑤ 달걀은 흰자와 노른자로 분리하여 도톰하게 부쳐내고 단무지는 김 길이로 썰어놓는다. ⑥ 찻잎은 꼭 짜서 소금과 참기름으로 양념해 무쳐준다. ⑦ 준비된 재료들로 김밥을 싸준다.",,2022-10-30
녹차 닭 가슴살 샐러드,닭가슴살 200g,"양상추 ½개, 꽃상추 1송이, 치커리 50g, 방울토마토 10개, 오이 ½개, 튀김옷(빵가루 1/4컵, 밀가루 1/4컵, 녹말가루 1/4컵, 녹차잎 1큰술, 달걀 1개), 샐러드드레싱(플레인요구르트 1컵, 마요네즈 2큰술, 레몬즙 3큰술, 설탕 2큰술, 소금 1작은술, 레몬즙 3큰술)","① 닭가슴살은 5~6cm 크기로 썰어 소금, 후추로 양념해준다. ② 닭가슴살에 소금과 후추로 간을 한 후 밀가루 ¼컵와 녹차잎 1큰술→계란→빵가루 ¼컵을 묻혀 튀겨준다.  ③ 플레인요구르트 1컵에 마요네즈 2큰술, 녹차가루 2큰술, 레몬즙 3큰술, 설탕 2큰술을 넣어 샐러드드레싱을 만들어준다.  ④ 양상추, 치커리, 꽃상추는 손으로 뜯어 놓고 방울토마토, 오이는 동글납작하게 썰어준다. ⑤ 접시에 채소를 깔고 튀긴 닭과 소스를 얹고 녹차가루로 장식해준다.",,2022-10-30
녹차 더덕무침,"더덕 200g, 녹차 5g","소금 1큰술, 설탕 1큰술, 깨소금 1큰술",① 더덕은 흙을 깨끗이 씻어 물기를 빼고 껍질을 벗겨준다. ② 마른 행주를 깔고 더덕을 방망이로 자근자근 두드려 잘 펴서 물에 담가 쓴 맛을 우려준다. ③ 더덕을 물기가 없이 꼭 짜서 가늘고 길게 찢은 다음 살살 버무려 가면서 양념과 물에 불려둔 녹차를 넣고 간이 고루 배어들도록 무쳐준다.,,2022-10-30
녹차 돈까스,"돼지고기안심돈까스용 2장, 녹차 2작은술","박력분 3큰술, 계란 1개, 우유 50cc, 빵가루 2컵, 소스(마요네즈 5큰술, 와사비 1작은술, 녹차가루 1작은술, 레몬즙 2작은술)","① 돼지고기는 고기망치로 두들긴 다음, 한입 크기로 썰고 녹차가루 1작은술, 후추로 조물조물 버무려준다. ② 밀가루, 녹차가루, 계란에 우유 섞은 것, 빵가루 순으로 옷을 입혀준다.  ③ 210℃ 정도로 예열된 오븐에서 오븐팬에 기름을 살짝 바르고 돈까스를 얹고, 기름을 약간 뿌려 20~25분 정도 바삭하게 구워준다.   ④ 완성된 돈까스에 소스를 곁들여준다.",,2022-10-30
녹차 돈까스,"돼지고기(안심, 돈까스용) 300g, 식용유 적당량, 녹차잎 1큰술(5g)","소금 1작은술, 양파즙 1큰술, 술 1큰술, 밀가루 ½컵, 달걀 2개, 빵가루 3컵, 우유 3큰술, 마요네즈 2큰술, 파인애플링 1개, 양파 ¼개, 파일애플통조림액 3큰술, 녹차가루 ½큰술, 백포도주 1큰술","① 돼지고기는 칼등으로 두드리고 핏물을 제거해준다. ② 녹차잎은 물에 불려 체에 받쳐 물기를 제거해준다. ③ 손질한 돼지고기는 녹차잎, 소금, 양파즙, 술을 넣고 20분간 재워준다. ④ 빵가루는 우유를 넣어 잘 버무려준다. ⑤ 재운 돼지고기에 밀가루, 달걀, 빵가루 순으로 옷을 입혀준다. ⑥ 튀김기름의 온도가 160∼170℃가 되면 돈까스를 튀겨준다. ⑦ 마요네즈, 파인애플, 녹차가루, 백포도주를 섞어 블렌더에 갈아서 소스를 만들어준다. ⑧ 그릇에 튀긴 돈까스와 소스를 곁들여준다.",,2022-10-30
녹차 돼지고기 탕수,"돼지고기안심200g, 녹차잎2큰술(10g)","오이1/4개(40g), 단호박1/8(100g), 통조림파인애플링3개(120g), 파랑피망1개(100g), 붉은피망½개(50g), 밑간양념장(간장½큰술, 청주1큰술, 참기름½큰술, 후춧가루약간), 튀김옷(튀김가루1컵, 물2/3컵), 소스(물½컵, 식초3큰술, 설탕2큰술, 파인쥬스½컵, 간장½작은술, 참기름1작은술, 소금½작은술, 녹말물2~3큰술)","① 돼지고기는 1cmX5cmX1cm로 썰어 준비해준다. ② 녹차잎은 물에 불려 체에 받쳐 물기를 제거해준다. ③ 썰어놓은 돼지고기와 불린 녹차잎에 밑간 양념장을 넣고 20분간 잰다. ④ 튀김가루는 물을 넣고 반죽해준다. ⑤ 잰 돼지고기와 녹차잎은 튀김옷을 입혀 160℃ 기름에 튀겨준다. ⑥ 단호박과 오이,  파인애플, 피망은 먹기 좋게 한 입 크기로 잘라준다. ⑦ 분량의 재료를 잘 섞어 소스를 만들어준다. ⑧ 준비한 단호박, 오이, 파인애플, 피망에 소스를 넣어 살짝 끓인 뒤 튀겨 놓은 돼지고기와 곁들인다.",,2022-10-30
녹차 두루말이,"녹차가루 1작은술, 밀가루 1컵","당근 ½개, 오이 1개, 팽이버섯 1개, 소금, 식용유",① 밀가루에 녹차가루를 섞고 소금물로 반죽을 걸쭉하게 해준다. ② 준비해놓은 야채는 5cm 길이로 채썰어 소금으로 간을 한 다음 살짝 볶아준다. ③ 팽이버섯은 적당한 크기로 찢어준다. ④ 프라이팬에 기름을 거의 없게 하여 반죽을 넣고 얇게 부쳐준다. ⑤ 익은 ④의 전병에 준비된 야채를 넣고 돌돌 말아준다. ⑥ 접시에 예쁘게 담아준다.,,2022-10-30
녹차 떡볶음,"쌀떡 400g, 녹차잎 3큰술(15g)","양파 ½개(50g), 당근 ½개(70g), 목이버섯 약간, 참기름 약간, 간장 약간, 소스(간장 2큰술, 설탕 1큰술, 물엿 1큰술, 참기름 1큰술, 물 ½컵, 소금 약간)","① 쌀떡은 적당한 크기로 잘라 끓는 물에 살짝 데쳐 참기름, 간장에 버무려준다. ② 양파와 당근은 떡과 비슷한 크기로 썰어준다. ③ 목이버섯은 물에 불려 반으로 잘라준다. ④ 녹차잎은 물에 불려 체에 받쳐 물기를 제거해준다. ⑤ 재료는 잘 섞어 소스를 만들어준다. ⑥ 팬에 기름을 두르고 준비한 양파, 당근, 녹차잎, 목이버섯을 넣고 볶다가 익으면 데친 쌀떡과 소스를 넣고 볶아준다.",,2022-10-30
녹차 떡케이크,"멥쌀가루 6컵, 녹차카루 3큰술(15g)","꿀 3큰술, 소금 약간, 물 6~8큰술, 잣 6큰술, 설탕 5큰술, 고명(대추 2개, 호박씨 2작은술, 잣 2작은술)","① 잣은 고깔을 떼어내고 칼날로 다져서 고운 가루로 만들어준다.   ② 멥쌀가루에 녹차가루와 꿀과 물을 섞어 넣어 잘 비벼서 중간 체에 내린 후, 잣가루와 설탕을 넣고 잘 섞어준다.   ③ 대추는 얇게 포를 뜬 후 돌돌 말아 썰거나 체로 썰어준다.  잣은 반으로 잘라 비늘잣으로 만들고, 호박씨도 반으로 갈라 고명을 만들어준다.   ④ 찜통에 젖은 면보를 깔고 떡가루를 안쳐 고명을 얹어준다.   ⑤ 김이 오른 찜기에 올려 가루 위로 김이 골고루 오르면 20분 정도 찐 후, 약한불로 5분간 뜸을 들여준다.   ⑥ 한김 나간 후 쟁반에 쏟아 썰어준다.",,2022-10-30
녹차 레모네이드,"녹차잎 5g, 레몬즙 1/4개분","물 300ml, 설탕시럽 1큰술, 각얼음 4개, 레몬(또는 라임)슬라이스 5조각",① 녹차잎에 85℃의 물을 부어 우려낸 후 식혀준다.   ② 녹차에 레몬즙과 설탕 시럽을 넣어 섞은 후 레몬을 슬라이스하여 넣고 각얼음을 넣어준다.,,2022-10-30
녹차 레몬에이드,"가루녹차 1작은술, 레몬 1개","사이다 2컵, 생수 1컵",① 생수에 가루녹차를 넣어 녹인 후 녹찻물을 얼음틀에 넣어 얼려둔다. ② 레몬은 깨끗이 씻어 물기를 닦아준다. ③ 레몬은 반으로 잘라 꼭 짜서 즙을 내어 거즈에 한번 걸러준다. ④ 걸러낸 레몬즙을 사이다 2컵과 섞어준다. ⑤ ④를 컵에 담고 녹차얼음을 넣은 뒤 레몬 조각으로 장식해 차게해서 준다.,녹차를 탄 물을 얼음틀에 먼저 얼려두어 레몬에이드에 타서 마신다. 얼음이 녹으면서 녹차의 맛과 향을 느낄 수 있을 뿐 아니라 더욱 시원하게 즐길 수 있다. ,2022-10-30
녹차 밀크 티,"가루녹차 1작은술(2g), 우유 200ml",물 50ml,① 우유는 낮은 불에서 보글보글 끓여준다.   ② 가루녹차는 끓은 물을 붓고 덩어리지지 않도록 저어준다.   ③ 저어준 가루차를 우유에 넣은 후 약한 불에서 뭉근하게 끓여준다.,,2022-10-30
녹차 바나나 쉐이크,"가루녹차 2작은술, 우유 1컵, 바나나 2개",생크림 1T,"① 바나나는 껍질 벗겨 썰어 믹서기에 넣어준다.  ② 생크림, 우유, 가루녹차를 넣어 믹서기를 돌려준다. ③ 컵에 담은 다음 녹차가루를 약간 솔솔 뿌려준다.",,2022-10-30
녹차 밥,"쌀 200g, 녹차잎 4큰술",,① 쌀은 씻어서 불려준다. ② 녹차를 미리 물에 담갔다가 찻잎과 그 물로 밥을 지어준다.,,2022-10-30
녹차 부침개,"부침가루 450g, 튀김가루 50g, 달걀 한개, 녹차가루 1큰술","물 850ml, 해조소금 1작은술, 청주 반큰술, 소금, 후추, 포도씨유, 애호박 반개, 홍고추 5개, 청양고추 3개, 양파 반개, 느타리버섯, 양송이버섯, 칵테일새우 등등","① 차거운물에 부침가루와 튀김가루를 섞어 거품기로 고루 섞어준다. ② 녹차분말을 넣고 가루에 멍울이 없게 거품기로 섞어준다. ③ 적당한 볼에 양파와 호박 채썬 것, 느타리버섯, 양송이버섯을 담고 반죽을 부어준다. ④ 달구어진 팬에 포도씨유를 넉넉히 두르고 반죽을 빙 둘러 얇게 올려준다. ⑤ 붉은 고추, 칵테일새우 등을 얹고 약불로 반죽의 윗부분이 익어갈 때까지 앞뒤가 노릇노릇하게 부쳐준다.",재료에 구애 받지 않고 냉장고 사정에 맞춰 넣어준다. 부침가루를 500g 사용해도 된다. 부침개는 얇팍해야 더 맛있다.,2022-10-30
