요리명,주재료,부재료,조리법 ,상세설명,데이터기준일자
녹차쉬폰,"달걀 3개, 설탕(흰자용) 40g, 설탕(노른자용) 30g, 우유 40g, 포도씨유 30g, 박력분 60g, 녹차가루 7g",,"① 가루는 체 쳐준다. ② 흰자는 설탕을 3번 나눠 넣으면서 단단한 머랭을 만들어준다. ③ 노른자에는 설탕을 다 넣고 아이보리빛이 날 때까지 휘핑해준다. ④ 노른자 휘핑한 것에 우유와 포도씨유, 바닐라익스트랙 4방울을 넣어준다. ⑤ 가루류를 체 쳐 넣어 가루가 안보일 때까지 섞어준다.(오븐은 170℃로 예열해준다.) ⑥ 머랭을 3번에 나누어 넣어준다. ⑦ 쉬폰 1호 틀에 분무기 또는 손으로 물을 뿌려준다. ⑧ 젓가락으로 2바퀴 정도 돌려 기포제거 후 바닥에 2번 탕탕 쳐서 기포를 제거해준다. ⑨ 오븐에 넣고 25~30분 익혀준다. ⑩ 다 굽고나면 바로 뒤집어서 식혀준다.",,2022-10-30
녹차쉬폰,"박력분 70g, 달걀 3개, 베이킹파우더 2g, 식용유 30g, 소금 약간, 설탕 60g, 물 30g",,"① 계란흰자에 설탕 30g을 넣고 머랭을 쳐준다. ② 다른 볼에 노른자를 풀다가 설탕을 넣고 섞어준다. ③ 물, 식용유를 조금씩 넣고 섞다가 녹차가루, 박력분, 베이킹파우더, 소금을 체 쳐 넣어준다. ④ 머랭을 넣고 머랭이 꺼지지 않게 섞어준다. ⑤ 틀에 물을 뿌리고 반죽을 넣고 젓가락으로 2~3번 저어준다. ⑥ 170℃에서 30~35분 정도 구워준다. (다 구워지면 뒤집어서 식혀준다.)",3인분 기준 60분 이내 완성,2022-10-30
녹차스콘,"박력분 160g, 베이킹파우더 7g, 녹차가루 7g, 생크림 165g, 설탕 35g, 소금 1g",크랜베리 40g,"① 박력분, 베이킹파우더, 녹차가루는 체에 내려준다. 소금과 설탕을 넣고 잘 섞어준다. ② 생크림을 넣고 고무주걱으로 잘 섞어 한덩어리가 되도록 만들어준다. ③ 건크랜베리를 넣고 반죽을 한덩어리로 뭉쳐준다. ④ 반죽을 비닐에 넣고 냉장고에서 30분 이상 휴지시켜준다. ⑤ 덧밀가루를 뿌린 후 반죽을 밀대로 밀어 3절 접기를 한 후 다시 3절 접기를 반복하여 반죽을 직사각형 모양으로 만들어준다. ⑥ 세모 모양이나 네모 모양으로 잘라준다. ⑦ 압력밥솥에 반죽을 넣어준다. ⑧ 만능찜 기능을 이용하여 익혀준다.",요리팁 압력밥솥 조리 후 윗면이 덜 익었다면 스콘을 뒤집어 다시 만능찜 기능을 이용하여 익혀준다. 오븐에 굽는다면 15~20분 정도면 완성할 수 있다.,2022-10-30
녹차스프레드,"생크림 500ml, 우유 1L, 설탕 150g, 녹차가루 20g",,"① 냄비에 우유, 생크림, 설탕을 넣어 끓여준다. (우유 1L, 생크림 500ml, 설탕 150g) ② 끓기 시작하면 녹차가루를 넣어 뭉치지 않게 거품기로 섞어준다. (녹차가루 20g) ③ 약불로 걸쭉해질 때까지 끓여준다.",6인분 기준 60분 이내 완성,2022-10-30
녹차스프레드,"우유 500ml, 생크림 250ml, 녹차가루 2t(5~10g), 설탕 2T(30g)",,① 우유 + 생크림을 섞고 설탕을 넣어준다. ② 녹차가루를 넣고 섞어준다. ③ 약불에서 계속 저어가며 30~40분간 끓여준다. ④ 약 ⅓ 정도로 쫄았을 때의 농도가 될 때까지 끓여준다.,,2022-10-30
녹차식혜,"엿기름 4컵, 물 18컵, 찬밥 1공기, 설탕 1컵, 꿀 ½컵, 녹차가루 1큰술","잣 약간, 대추 약간","① 베주머니에 엿기름을 넣고 큰 볼에 담아준다. 엿기름을 우릴 때 녹차티백을 2개 넣어준다. 물은 18컵을 부어준다. ② 베주머니를 조물조물 주물러서 엿기름물이 잘 우러나오도록 한 뒤 3시간 정도 놔둔다. 그런 다음 윗물만 따라준다. ③ 슬로우쿠커(없으면 전기보온밥솥)에 엿기름 국물의 윗물만 따라내준다. ④ 찬밥을 1공기 넣어준다. 밥알이 잘 풀리도록 주걱으로 저어준다. ⑤ 뚜껑을 닫고 저온에서 6~7시간 정도 놔둔다. ⑥ 밥알만 건져서 찬물에 헹궈준다. 그리고 그릇에 따로 담아 둔다. ⑦ 식혜 국물에 설탕 1컵을 넣고 뚜껑을 닫고 고온에서 팔팔 끓을 때까지 놔둔다. ⑧ 팔팔 끓고나면 불을 끄고 꿀 반컵을 넣어주고, 식혀준다. ⑨ 식혜가 다 식으면 녹차 가루를 1큰술 넣어서 잘 저어준다. ⑩ 식혜국물과 따로 담아둔 밥알을 합쳐준다.",분량: 6인분 이상 조리시간: 2시간 이상 요리팁 ①번 과정에서 물을 미지근하게 해서 우리면 더 잘 우러나온다. ③번 과정에서 볼 밑바닥에 엿기름 앙금은 넣지 않아야 한다. 앙금이 들어가면 식혜의 색상이 검으스름해진다. ⑤번의 과정에서 설탕 1큰술을 넣어주면 발효가 더 빨리 진행된다.,2022-10-30
녹차쌀샤브레쿠키,"무염버터 100g, 에리스리톨 45g, 비정제원당 18g, 소금 1g, 노른자 1개, 유기농 녹차가루 8g, 박력쌀가루 137g",카카오닙스 30g,① 무염버터를 주걱으로 부드럽게 풀어준다. (무염버터가 충분히 부드럽게 풀어져야 계란과 분리가 안된다.) ② 감미료를 넣고 섞어준다. ③ 노른자를 넣고 섞어준다. ④ 녹차가루를 넣고 섞어준다. ⑤ 박력쌀가루를 넣고 섞어준다. ⑥ 카카오닙스를 넣고 섞어준다. ⑦ 반죽을 한덩이로 뭉쳐준다. ⑧ 종이유산지 위에 반죽을 올리고 돌돌 말아서 모양을 잡아준다. ⑨ 랩핑한 후 냉동실에서 20분간 굳혀준다. ⑩ 1cm 간격으로 잘라준다. ⑪ 170/180℃로 예열해 둔 오븐에서 20~25분 동안 구워준다.,,2022-10-30
녹차약식,"찹쌀 2컵, 밤 15개, 대추 10개, 호박씨 1큰술, 크랜베리 40g, 잣 1큰술, 물 1컵","소금 ½큰술, 설탕 ½컵, 녹차가루 2큰술, 참기름 2큰술, 꿀 1큰술","① 찹쌀은 물에 2시간 정도 불려 체에 밭쳐준다. ② 밤은 껍질을 까서 준비해준다. 대추는 돌려깎기를 한 후 씨를 제거하고 채썰어준다. ③ 압력밥솥에 물 1컵과 설탕, 소금을 넣고 살짝 끓여준다. 설탕이 녹기만 하면 불에서 내린 후 불린 찹쌀, 밤, 대추, 크랜베리를 넣어준다. ④ 녹차가루 2큰술을 넣어 잘 섞어준다. ⑤ 압력밥솥 뚜껑을 닫고 센불에서 끓기 시작하면 바로 약불로 줄여 3~4분 정도 뜸을 들인 후 압력이 다 빠져나가면 뚜껑을 열어준다. ⑥ 다 된 녹차약식은 볼에 담은 후 잣, 호박씨, 참기름, 꿀을 넣은 후 잘 섞어준다.",분량: 3인분 기준 조리시간: 60분 이내,2022-10-30
녹차양갱,"가루한천 ½큰술, 물 1컵, 녹차가루 1큰술, 백앙금 200g","백설탕 1큰술, 소금 0.5g, 물엿 1큰술",① 가루한천 ½큰술을 담고 물 1컵을 붓고 3시간 이상 불려 준비해준다. ② 녹차가루는 물 2T를 넣고 개어준다. 가루를 직접 넣으면 뭉쳐져서 망칠 수 있으니 항상 개어서 사용해준다. ③ 먼저 불린 한천을 넣고 중불에서 은근히 끓여준다. ④ 어느정도 한천이 불면 설탕→소금→백앙금 순서로 넣어 끓여준다. ⑤ 약불에서 팥을 잘 풀은 뒤 센불로 올려 용암처럼(5분) 끓으면 불을 줄이고 중불로 10분 이상 끓여 약불로 5분 정도 끓여준다. ⑥ 그리고 녹차가루와 물 2T를 넣고 개어놓은 녹차물을 붓고 고루 섞어 살짝 끓여준다. ⑦ 마지막으로 물엿을 넣어주고 불을 끄고 한김 식혀준다. 물엿을 넣어주면 식감이 부드러워진다. ⑧ 틀에 2~3mm 정도 부은 다음 실온이나 냉장고에서 굳혀준다. (30분~1시간 정도),,2022-10-30
녹차양갱쿠키,"박력분 5큰술, 녹차 ½큰술, 버터 2큰술, 양갱 ⅓개 ",설탕 2큰술,① 가루 재료를 넣고 스푼으로 고루 섞어준다. 녹차는 평평하게 담아준다. ② 버터 두 큰술을 넣고 스푼을 세워서 자르듯이 섞어준다. ③ 동그랗게 빚어준다. ④ 네번째 손가락으로 반죽 중앙을 꾹 눌러준다. ⑤ 전자레인지 안에 있는 유리판에 유산지나 종이호일을 깔고 반죽을 띄엄띄엄 놔준다. 그대로 아무것도 덮지 않고 해동기능에서 1분 40초간 돌려준다. ⑥ 1분 40초가 지나면 바로 반죽중앙에 자른 양갱을 꾹하고 박아준다. (뜨거울 때 해야 양갱이 들어간다.) 그리고 해동기능으로 40초간 더 돌려준다. ⑦ 양갱이 끓어 넘치치 않게 계속 지켜봐준다. ⑧ 차가운 곳에서 한김 식혀내준다.,"양갱은 작게 잘라주어야 한다. 버터는 실온에 둬서 부드러운 상태로 준비해준다. 전자레인지에 따라 익는 속도가 다르다. 1,100w 기준 이하의 전자레인지에서는 익히는 시간을 높여주고, 이상의 전자레인지는 시간단축을 해준다. 전자레인지에 따라 사양이 다르니 타지 않게 주의하면서 구워준다. 해동기능으로 구워주지 않으면 탈 수 있다. 밥스푼계량으로 녹차를 제외한 가루류를 소복히 담아주면 된다.",2022-10-30
녹차연유쿠키,"버터 40g, 아몬드가루 15g, 계란 노른자 1개, 녹차가루 5g, 박력분 60g, 연유 10g, 설탕 30g",,① 버터를 풀어주고 설탕과 연유와 계란을 넣고 섞어준다. ② 가루류를 모두 넣고 섞어준다. ③ 랩 또는 유산지에 감싸 냉동실에 20분 넣어준다. ④ 일정한 크기로 밀대로 밀어 무스링이나 쿠키커터 등에 찍어서 모양을 내준다. ⑤ 170℃에서 15분간 구워준다.,3인분 기준 60분 이내 완성,2022-10-30
녹차와플,"와플믹스 1봉지, 달걀 1개, 녹인버터 60g, 녹차파우더 1큰술, 물 150ml",토핑용과일 약간,① 달걀과 물을 넣고 잘 풀어준다. ② 믹스와 녹차파우더를 넣어준다. ③ 녹인 버터를 부어 잘 섞어준다. ④ 와플팬에 오일이나 버터를 살짝 발라주고 예열해준다. ⑤ 반죽을 적당량 부어 앞뒤 노릇하게 구워준다. ⑥ 접시에 담고 토핑용 과일을 올리고 녹차파우더를 톡톡 뿌려준다.,분량: 4인분 기준 조리시간: 30분 이내 요리팁 버터는 전자레인지에 30~40초 정도 돌려 녹이면 된다. 반죽을 하루 정도 숙성했다 구우면 더 맛있다. 와플팬에 반죽을 너무 꽉 차게 부으면 밖으로 새니 약간 모자란듯 부어준다.,2022-10-30
녹차우유,"우유 150ml, 그린티파우더 1개",,① 우유를 컵에 붓고 전자레인지에 우유를 데워준다. ② 컵에 그린티파우더를 1개 넣고 데운 우유 3큰술 넣은 후 그린티파우더를 덩어리지지 않게 녹여준다. ③ 데운 우유를 부어준다.,1인분 기준 5분 이내 완성,2022-10-30
녹차인절미,"찹쌀가루 2종이컵, 따뜻한물 1과½종이컵, 설탕 1과½숟가락, 녹차가루 2숟가락, 소금 ½숟가락, 콩가루 ⅓종이컵",,"① 찹쌀가루, 녹차가루에 소금, 설탕을 넣고 섞은 후 따뜻한물을 조금씩 나눠가며 부어 익반죽해준다. ② 랩을 씌운 후 구멍을 뚫고 전자레인지에 2분 돌린 후 치대준다. (2번 반복) ③ 손에 참기름을 바르고 떡을 떼어내 콩가루를 묻혀준다.",분량: 2인분 기준 조리시간: 10분 이내,2022-10-30
녹차잼,"설탕 넣어 휘핑한 생크림 300g, 말차가루 3큰술, 우유 600g",,"① 깊이가 있는 냄비에 휘핑한 생크림을 담고, 우유를 부어준다. ② 핸드거품기로 잘 저어주어 생크림과 우유가 섞이게 한다. 불은 중불로 해서 끓여준다. ③ 생크림+우유가 끓기 시작하면 말차가루를 넣어준다. ④ 거품기로 잘 저어가며 끓여준다.(충분한 농도가 될 때까지 오랫동안 끓여준다.) ⑤ 충분히 되직해지면 불을 끄고 통에 잘 부어 담아준다. 바로 밀봉하여 냉장고에 넣어준다.",조리시간: 60분 이내 요리팁: 휘핑한 생크림과 우유의 비율은 1:2로 해주면 된다.,2022-10-30
녹차잼,"녹차가루 45g, 백설자일로스설탕 200g, 우유 1L, 생크림 500ml",,"① 잼용 용기는 끓는물에 끓여 소독한 뒤 물기를 제거해준다. ② 냄비에 녹차가루, 자일로스설탕, 우유, 생크림을 넣고 섞은 뒤 중불에서 끓여준다. ③ 농도가 걸쭉해질 때 까지 끓여준다. (약 35~40분간) ④ 완성된 녹차잼을 식힌 뒤 소독된 용기에 담아준다.",분량: 2인분 기준 조리시간: 60분 이내,2022-10-30
녹차전복돌솥밥,"멸치다시육수 200ml, 불린쌀 200g, 녹차잎 1t, 전복 6마리","생표고버섯 2개, 황금송이버섯 1개, 밤호박 1/8개, 무염버터 1T, 멸치다시육수(다시멸치 1줌, 다시마 1쪽, 물 500ml), 전복살밑간양념(맛간장 1T, 참기름 ½T, 통깨 약간), 양념(양조간장 5T, 맛술 4T, 다진마늘 ½T, 참기름 2T, 풋고추 2T, 쪽파 3줄기, 통깨 취향껏, 고춧가루 1T)","① 멸치다시육수를 준비해준다. 물 500ml에 멸치, 다시마를 넣고 3분간 끓여준다. 물이 끓고 3분 뒤 다시마를 건져준다. ② 흐르는 물에서 솔로 깨끗이 씻은 전복은 껍데기와 살 사이에 숟가락을 넣고 살을 분리해준다. ③ 전복의 더듬이와 이빨을 칼로 잘라 제거해준다. 내장은 분리해 따로 담아준다. ④ 전복살은 먹기좋은 크기로 편썰기로 잘라주고, 맛간장, 참기름, 통깨로 밑간 해준다. ⑤ 전복내장과 멸치다시육수를 믹서기에 넣어 갈고 녹차잎을 같이 넣고 섞어준다. ⑥ 단호박은 얇게 편썰기 해 준비해 두고 버섯은 먹기좋게 썰어 준비해준다. ⑦ 전자레인지용 뚝배기에 불린 쌀을 담고 단호박을 군데군데 겹겹이 넣어준다. 버섯, 편 썬 단호박을 고명으로 올리고 그 위에 육수를 부어준다. ⑧ 전자레인지로 5분 가량 돌려준다. 1분 가량 뜸을 들여준다. 이때, 1분 동안은 그대로 둔다. ⑨ 뜸 들인 뒤 바로 5분 돌려 밥을 완성하고, 그 위에 버터 1T를 올려준다. 편 썰어준 전복을 고명으로 올려 2분 30초 돌려준다. ⑩ 다 된 밥을 접시에 덜고 양념장을 취향에 맞게 넣고 비벼먹는다.",분량: 2인분 기준 조리시간: 30분 이내,2022-10-30
녹차주먹밥,"쌀 2컵, 쌈채소(상추/깻잎) 16장, 녹차잎 1.5큰술, 소금 ⅓작은술, 참기름 1큰술","[견과류쌈장] 견과류(해바라기씨/호박씨/잣) 2큰술, 된장 2큰술, 고추장 1큰술, 조청 1큰술, 다진마늘 ½큰술, 통깨 1작은술, 참기름 1큰술","① 쌀은 두 번 흐르는 물에 씻은 후 30분간 불려준다. ② 불린 쌀을 솥에 담고 물 2컵, 잎녹차 1.5큰술을 넣어서 압력취사로 밥을 지어준다. ③ 완성된 녹차밥은 골고루 섞어준다. ④ 밥이 뜨거울 때 소금 ⅓작은술과 참기름 1큰술을 넣어 뜨거운 열에 소금이 녹도록 뒤적뒤적 해준다. ⑤ 한김 식힌 후 한수저씩 떠서 동그란 주먹밥 모양으로 만들어준다. ⑥ 녹차주먹밥을 상추와 깻잎 위에 올려서 도시락에 담아준다. ⑦ 견과류는 기름을 두르지 않은 마른 팬에 노릇해질 정도로 볶아준다. ⑧ 밥이 되고 있는 동안 분량의 쌈장 양념에 볶은 견과류 넣어준다. ⑨ 준비된 견과류 쌈장을 조금씩 밥 위로 얹어준다.",,2022-10-30
녹차찹쌀앙금머핀,"찹쌀가루 110g, 녹차가루 4g, 베이킹파우더 ½ts, 설탕 60g, 소금 ½ts, 우유 100g, 계란 2개, 버터 40g","적앙금, 토핑용 견과류","① 우유와 계란을 한 데 섞어서 계란을 잘 풀고 우유와 섞어준다. ② 체 친 가루류(찹쌀가루, 녹차가루, 베이킹파우더)를 ①에 넣고 설탕과 소금까지 넣고 잘 섞어준다. ③ 중탕으로 녹여둔 버터도 넣고 섞어준다. 버터는 끓는물 위에 다른 볼을 얹고 중탕을 해도 되고, 전자레인지에 돌려 녹여도 된다. ④ 한김 식힌 후에 반죽에 넣어준다. ⑤ 머핀팬에 반죽을 ½정도 넣어주고 동그랗게 빚어둔 앙금을 넣어준다. ⑥ 앙금이 덮일 정도로만 나머지 반죽을 채워준다. ⑦ 180℃에서 25분 구워준다. ⑧ 다 구워졌다면 꺼내서 식혀준 후 취향껏 데코를 올려준다.",머핀 틀 6개분량,2022-10-30
녹차초밥 연어 샐러드,"연어회 10조각, 밥 1공기, 양파 ⅓개, 샐러드잎 1줌, 무순 1줌, 삶은콩 ½컵 ","[양념] 녹차가루 1t, 뜨거운물 1t, 소금 약간 [초밥 드레싱] 올리브오일 2큰술, 매실청 1큰술, 식초 2큰술, 와사비 0.5큰술, 다진마늘 0.5큰술, 소금 약간","① 양파(⅓개), 연어회(10조각)는 다져주고, 양파는 찬물에 10분 정도 담가 매운맛을 빼준 다음 체에 받쳐 물기를 제거해준다. ② 녹차가루(1t)+뜨거운물(1t)을 섞어 녹차가루를 녹여주고, 초밥 드레싱을 한 데 섞어 만들어준다. ③ 밥(1공기)에 녹차가루 녹인 것 모두와 초밥 드레싱을 반 정도 넣어 잘 섞어주고, 밥에 약간의 소금간을 해주어 짭짤하게 해준다. ④ 샐러드잎(1줌)은 깨끗이 씻어 놓고, 무순(1줌)도 흐르는 물에 헹궈주고, 기호에 맞게 삶은 콩(½컵)을 준비해준다. ⑤ 접시에 초밥을 깔고 그 위로 양파, 연어, 샐러드잎, 무순, 콩을 얹어준 뒤 마저 남은 초밥 드레싱을 끼얹어 섞어준다.",,2022-10-30
녹차초코 샤브레,"박력분 110g, 아몬드가루 30g, 자일로스설탕 40g, 달걀노른자 1개, 버터 65g, 바닐라오일 2g, 말차가루 3g, 초코칩 40g","설탕 약간, 달걀흰자 약간",① 실온에 버터를 크림화시킨 후에 설탕을 넣어 섞어준다. ② 달걀 노른자를 넣어 잘 섞어준다. ③ 가루류와 말차가루를 넣고 초코칩을 넣어 잘 섞어준 후에 반죽이 한덩이가 되면 유산지를 깔고 동글하게 성형해준다. ④ 유산지를 감싼 후에 냉동실에 1~2시간 놓아준다. ⑤ 반죽을 꺼내 달걀 흰자를 겉에 발라준 후에 설탕을 묻혀준다. ⑥ 0.6~0.7cm 두께로 썰어준다. ⑦ 오븐 170℃에 10~12분 구워준다. (오븐 사양에 따라 시간과 온도를 조절해준다.),샤브레는 오븐온도가 높거나 오래 구우면 타버릴 수 있으니 중간에 굽다가 색을 잘 보면서 종이호일을 덮어주면 좋다.,2022-10-30
녹차초코찰떡파이,"찹쌀가루 1+½종이컵, 물 1종이컵, 전분가루 약간, 녹차초콜릿 1종이컵",,"① 찹쌀가루에 물을 넣고 반죽이 묵직하게 흐르는 정도로 섞어준다. ② 랩을 씌워 구멍을 낸 후, 전자레인지에 1분씩 3번을 나눠서 돌려준다. ③ 찹쌀반죽을 찰기가 생길 정도로 여러번 섞어준다. ④ 찹쌀반죽이 달라붙지 않도록 전분가루를 묻혀준다. ⑤ 찹쌀반죽을 떼어내 동그랗게 빚어 모양을 잡은 후, 냉동실에 10분 보관해준다. ⑥ 녹차초콜릿을 전자레인지에 15초씩 3번 돌려서 녹인 후, 덩어리가 없게 잘 섞어준다. ⑦ 냉동보관해둔 찹쌀반죽을 녹인 초콜릿에 넣고 골고루 묻혀준다. ⑧ 초콜릿이 굳을 때까지 냉동보관 또는 1시간 실온에 보관해준다.",실온보관을 하면 초콜릿이 빠르게 녹는 걸 방지할 수 있다.,2022-10-30
녹차초코칩 샤브레,"버터 120g, 달걀 50g, 박력분 240g, 가루녹차 4큰술, 초코칩 80g, 달걀 흰자 약간","묻힘설탕 적당량, 슈거파우더 80g","① 버터는 말랑한 상태로 120g, 달걀도 차지 않은 상태로 노른자와 흰자를 반만 준비해서 약 50g 준비해준다. 그리고 슈가파우더 80g, 녹차가루 계량스푼으로 4큰술, 박력분 240g, 달걀 흰자 적당량과 겉에 묻혀줄 설탕 적당량을 계량해둔다. ② 먼저 실온의 부드러운 버터를 볼에 넣고 거품기로 젓다가 슈가파우더를 3~4차례 나눠 넣으면서 버터와 섞이도록 거품기로 저어준다. ③ 버터와 슈가파우더가 잘 섞였으면 먼저 달걀의 노른자만 넣고 섞고 이어서 흰자도 같이 넣어서 거품기로 잘 저어준다. ④ 거품기를 조심스럽게 털어서 거품기에 남아 있는 반죽이 없게 잘 털어준 뒤에 체에 친 박력분 240g과 녹차가루 4큰술을 넣어준다. 그리고 주걱을 세워 재빨리 가루 종류와 버터반죽을 같이 섞어준다. 박력분과 가루녹차는 체에 쳐서 굵직한 알갱이는 걸러내고 사용해준다. ⑤ ⅔쯤 반죽이 섞였으면 초코칩을 80g 넣고 날가루가 보이지 않도록 섞어준다. ⑥ 잘 섞인 반죽은 3덩어리로 나눠서 동그랗게 또는 네모지게 기둥 모양으로 만들고 이것을 랩 또는 종이호일 등을 이용해서 싸고 냉동실에 2~3시간 두어 딱딱하게 굳혀준다. ⑦ 겉면에 달걀 흰자를 골고루 바르고 설탕을 꼼꼼히 묻혀준다. ⑧ 약 두께 0.7cm 정도로 썰어서 오븐 팬에 간격을 두어 펼쳐 넣고 미리 170℃로 예열한 오븐에 넣고 12~15분간 구워준다.",6인분 기준 2시간 이상 걸림,2022-10-30
녹차카라멜,"생크림 146g, 설탕 146g, 녹차가루 2ts, 올리고당 1Ts",,① 그릇에 녹차가루를 넣고 생크림을 조금씩 부어가며 잘 풀어준다. ② ①의 생크림을 체에 거른 뒤 냄비에 붓고 약불에서 끓여준다. ③ 팔팔 끓이지 않고 작은 기포가 생길 때까지 끓여준다. ④ 분량의 설탕을 넣고 약불에서 서서히 끓여준다. 절대로 휘휘 저으면 안된다. 설탕이 녹게끔 팬만 살짝 흔들어준다. ⑤ 올리고당 1큰술을 넣고 끓여준다. 농도가 잡히면 불에서 내려준다. ⑥ 적당한 틀에 부어서 차가운 곳에 식혀준다.,4인분 기준 60분 이내 완성,2022-10-30
녹차카스테라,"쌀가루박력분 115g, 녹차가루 10g, 설탕 115g, 우유 25g, 꿀 20g, 달걀 4개, 바닐라익스트랙 조금, 청주 1큰술, 버터 25g, 베이킹파우더 1g",,"① 버터와 우유를 전자레인지를 이용해 녹여주고 청주까지 섞어준다. ② 달걀의 멍울을 풀어 주고 설탕을 서너번에 나누어 넣으며 휘핑해준다. (멍울풀기 - 고속휘핑 - 중속휘핑 - 저속휘핑 단계) ③ 믹서기를 들어올렸을 때 반죽이 떨어져 3초 정도 멈춰있거나 그림을 그려보아 변하지 않으면 휘핑을 멈춰준다. 체에 두어번 내린 가루류를 넣고 반죽을 바닥에서 위로 퍼올리듯 가볍게 섞어준다. 이때 볼 가장자리도 정리해준다. 미리 녹여둔 버터에 본반죽을 조금 떠넣고 고루 섞어 본반죽에 넣고 섞어준다. ④ 오븐팬에 유산지나 테프론시트지를 깐 뒤 카스테라 틀에 유산지를 맞게 잘라넣고, 반죽을 위에서 아래로 떨어뜨리듯이 부어준다. 오븐팬을 가볍게 탕탕 쳐주고 160℃로 예열된 오븐에서 20분, 150℃로 내려 20~25분 정도 구워준다. 윗면이 탄다 싶으면 종이호일을 한번 덮고 구워준다. ⑤ 구워져 나오면 종이호일을 깐 바닥에 뒤집어 식혀준다.",60분 이내 완성,2022-10-30
녹차카스테라,"강력분 200g, 계란 8~10개, 설탕 230g, 물엿(꿀) 3큰술, 술(미림·정종·럼주 등) 10cc, 녹차가루 2큰술, 온수 2큰술, 우유 40cc, 소금 조금, 바닐라에센스 1작은술",,① 계란 10개를 넣고 휘핑을 쳐준다. ② 계란 전란에 소금을 조금 넣고 휘핑하다가 설탕을 넣고 뽀얀 미색이 날 때까지 휘핑해준다. 설탕이 안녹는다면 팔팔 끓인물에 볼을 담갔다가 볼이 따끈해지면 다시 휘핑해주고 다시 중탕했다가 휘핑하기를 두세번 정도 해준다. ③ 녹차가루를 온수에 풀어서 조금씩 흘려 넣고 휘핑해준다. ④ 두번 체 친 강력분을 넣고 반죽을 해준다. ⑤ 유산지를 깔아둔 카스테라 틀에 반죽을 넣고 주걱이나 거품기로 휘저어 공기를 빼준 후 180℃ 오븐에서 35분 굽고 온도를 낮추어 160℃ 오븐에서 10분간 더 구워준다. ⑥ 구운 후 뒤집어 식힘망에 올려 식혀주고 틀을 제거하고 유산지는 그대로 둔 체로 식혀준다. 카스테라가 완전히 식었을 때 빵칼로 잘라준다.,6인분 기준 60분 이내 완성,2022-10-30
녹차쿠키,"버터 160g, 분당 60g, 계란흰자 34g, 소금 1g, 바닐라익스트랙, 박력분 180g, 녹차가루 5g",,"① 실온에 두어 말랑해진 버터를 크림화해준다. ② 분당을 여러번 나누어 버터에 섞어준다. ③ 바닐라익스트랙과 소금을 넣어 섞어준다. (버터+분당+바닐라익스트랙+소금 모두 섞인 상태) ④ 계란 흰자를 넣어 섞어준다. ⑤ 여기에 가루류를 모두 넣어준다. 가루는 2~3회 체 쳐서 준비해준다. ⑤ 박력분을 체 쳐서 넣고, 녹차가루도 나누어 넣어준다. ⑥ 짤주머니에 넣어 짜준다. ⑦ 오븐 170℃로 15분 구워준다. 10분 구워준 후 방향을 바꿔 5분간 구워준다.",,2022-10-30
